{
  "schemaVersion": "1",
  "name": "service-tempo",
  "tenant": "gravity-ui",
  "service": {
    "title": "Tempo",
    "domain": "Помодоро-таймер с синхронизацией носимых устройств",
    "audience": "Люди, которым важно поддерживать оптимальный темп работы и отдыха",
    "description": "Публичный продукт (текущая версия — в обёртке Electron, за счёт чего быстро обновляется). На Гравити собирается настроечная и описательная часть: легковесно, но мощно и полезно; современно и технологично."
  },
  "theme": {
    "base": "light",
    "allowSwitch": true,
    "note": "Дефолтная светлая тема Гравити + переключатель light/dark. Собственного бренда нет — themeConfig/brandTokens опущены (омиссия = дефолтный акцент); воздушный/легковесный посыл."
  },
  "density": {
    "default": "spacious",
    "note": "Хороший запас воздуха — крупные отступы, size m; показать что-то легковесное, но мощное."
  },
  "contentLayout": {
    "width": "fluid-capped",
    "maxWidth": "1120px",
    "align": "center",
    "adaptive": {
      "policy": "desktop-first",
      "breakpoints": "Desktop-first: живёт в Electron-окне (ресайзится); ниже md — упрощённая одноколоночная раскладка."
    },
    "note": "Контент по центру с комфортным max-width 1120px; не на всю ширину."
  },
  "formPolicy": {
    "fieldWidth": "uniform",
    "formMaxWidth": "560px",
    "labelPlacement": "form-row-top",
    "descriptionDefault": "field-description",
    "requiredMarking": "per-field",
    "note": "Просторные настройки публичного продукта: подписи сверху, описания под полем, единая ширина, обязательные — звёздочкой."
  },
  "approvedComponents": {
    "policy": "open",
    "preferred": {
      "Описательная / промо / продуктовая страница": "@gravity-ui/page-constructor (config-driven блоки)",
      "Выбор длительности интервала с наглядностью": "Slider — для публичного продукта визуальный выбор уместен"
    },
    "note": "Открытый набор. page-constructor — для описательной части; uikit-контролы — для настроек."
  },
  "archetypes": [
    {
      "name": "Настройки",
      "when": "Настройка интервалов фокуса/перерывов, подключённых устройств, уведомлений",
      "structure": "Полоса 560px по центру, FormRow с подписью сверху, Slider/NumberInput для длительностей, Switch для уведомлений, Toaster на «Сохранено».",
      "ref": "recipe-settings-form"
    },
    {
      "name": "Описание / промо",
      "when": "Рассказать о продукте и его возможностях",
      "structure": "PageConstructorProvider → PageConstructor с блоками Hero / Features / CTA. Просторно, одна крупная CTA.",
      "ref": "recipe-landing"
    }
  ],
  "glossary": [
    {
      "term": "Сессия фокуса",
      "meaning": "Рабочий интервал (помодоро)",
      "preferredLabel": "Фокус"
    },
    {
      "term": "Короткий перерыв",
      "meaning": "Пауза между фокус-сессиями",
      "preferredLabel": "Короткий перерыв"
    },
    {
      "term": "Длинный перерыв",
      "meaning": "Большая пауза после серии сессий",
      "preferredLabel": "Длинный перерыв"
    },
    {
      "term": "Темп",
      "meaning": "Ритм чередования работы и отдыха",
      "preferredLabel": "Темп"
    },
    {
      "term": "Устройство",
      "meaning": "Носимое устройство для синхронизации",
      "preferredLabel": "Устройство"
    }
  ],
  "conventions": [
    "Длительности интервалов — в минутах, единый формат (напр. «25 мин»).",
    "Статус подключения носимого устройства — через Label с theme (не цветной Text)."
  ],
  "provenance": {
    "synthesizedFrom": [
      "Интервью (auto-synthesis prototype, 2026-06-09): свободное описание сервиса + 1 уточняющий вопрос (тема)."
    ],
    "lastUpdated": "2026-07-11",
    "notes": "Профиль выведен из интервью: density/contentLayout/formPolicy/approvedComponents/archetypes/glossary — из описания; тему спросили (light + switch, бренда нет). referenceScreens нет (кода не было). 2026-07-11: убран нештатный widthBuckets.default — при fieldWidth=uniform единую ширину уже задаёт formMaxWidth (паттерн sprout: омиссия)."
  }
}
