{
  "schemaVersion": "1",
  "name": "service-aurora",
  "tenant": "gravity-ui",
  "service": {
    "title": "Aurora",
    "domain": "Платформа онлайн-мероприятий и продажи билетов",
    "audience": "Внешние организаторы и посетители мероприятий (часто с мобильных)",
    "description": "Публичный продукт: маркетинговые страницы, настройка мероприятий, покупка билетов. Бренд и «воздух» — лицо продукта, плотность вторична."
  },
  "theme": {
    "base": "light",
    "allowSwitch": false,
    "themeConfig": {
      "json": "../themes/aurora.theme.json",
      "css": "../themes/aurora.theme.css",
      "scopes": [
        "light",
        "dark"
      ],
      "source": "Themer-экспорт ‘Baseline by Simon’ (синий бренд #0080FF, полная палитра + семантика на light и dark)"
    },
    "note": "Светлая фирменная тема, переключатель НЕ даём — единый бренд на публичном продукте. Бренд — фирменная Themer-тема (синий акцент), импортируется целиком из themes/aurora.theme.css; токены руками не подбираем (см. pattern-theming)."
  },
  "density": {
    "default": "spacious",
    "note": "Публичные экраны — воздух и крупная типографика: size=\"m\", крупные отступы между блоками. Отступление от universal-дефолта normal в сторону просторного."
  },
  "contentLayout": {
    "width": "fluid-capped",
    "maxWidth": "1120px",
    "align": "center",
    "adaptive": {
      "policy": "mobile-first",
      "breakpoints": "Mobile-first: одна колонка на мобильном, две — от md; контент центрируется и ограничен 1120px на десктопе. Экраны обязаны хорошо смотреться на телефоне (билеты покупают с мобильных)."
    },
    "note": "Контент по центру с комфортным max-width 1120px; не на всю ширину (в отличие от ops-консолей)."
  },
  "formPolicy": {
    "fieldWidth": "uniform",
    "widthBuckets": {
      "default": "100% в пределах полосы формы — поля единой ширины"
    },
    "formMaxWidth": "560px",
    "labelPlacement": "form-row-top",
    "descriptionDefault": "field-description",
    "requiredMarking": "per-field",
    "note": "Поля единой ширины на всю полосу 560px; подпись сверху (дружелюбно на мобильном); описания — под полем (внешнему пользователю всё на виду, НЕ прячем в HelpMark); обязательные — звёздочкой у каждого (внешнему пользователю явнее)."
  },
  "approvedComponents": {
    "policy": "open",
    "preferred": {
      "Маркетинговая / промо / продуктовая страница": "@gravity-ui/page-constructor (config-driven блоки Hero/Features/Pricing/CTA)",
      "Выбор значения в диапазоне (вместимость, бюджет)": "Slider — наглядность важнее точной цифры"
    },
    "note": "Открытый набор. page-constructor — основной инструмент публичных страниц; Slider приветствуется там, где визуальный выбор уместен (в отличие от ops-сервисов, где нужны точные числа)."
  },
  "archetypes": [
    {
      "name": "Промо-страница мероприятия",
      "when": "Публичная страница события / лендинг",
      "structure": "PageConstructorProvider → PageConstructor с блоками Hero / Features / Pricing / CTA. Одна крупная CTA-кнопка.",
      "ref": "recipe-landing"
    },
    {
      "name": "Настройка мероприятия",
      "when": "Организатор создаёт / редактирует событие",
      "structure": "Полоса 560px по центру, FormRow с подписью сверху, описания под полем, per-field required, Slider для вместимости, Toaster на «Сохранено».",
      "ref": "recipe-settings-form"
    }
  ],
  "glossary": [
    {
      "term": "Мероприятие",
      "meaning": "Событие, на которое продаются билеты",
      "preferredLabel": "Мероприятие"
    },
    {
      "term": "Билет",
      "meaning": "Право посещения мероприятия",
      "preferredLabel": "Билет"
    },
    {
      "term": "Организатор",
      "meaning": "Создатель и владелец мероприятия",
      "preferredLabel": "Организатор"
    },
    {
      "term": "Площадка",
      "meaning": "Место проведения (онлайн или офлайн)",
      "preferredLabel": "Площадка"
    }
  ],
  "referenceScreens": [
    {
      "name": "Промо-страница (эталон)",
      "ref": "internal://aurora/src/pages/EventLanding.tsx",
      "note": "Канонический лендинг на page-constructor."
    },
    {
      "name": "Создание мероприятия (эталон)",
      "ref": "internal://aurora/src/pages/EventSetup.tsx",
      "note": "Канонская форма: полоса 560, подпись сверху, FieldDescription."
    }
  ],
  "conventions": [
    "Главная CTA-кнопка на публичном экране может быть Button size=\"l\" (бренд-акцент), несмотря на общий size=\"m\" для spacious — сознательное исключение под публичный характер.",
    "Изображения мероприятий — с обязательным alt и lazy-loading: публичный продукт, важны a11y и SEO.",
    "Цены и суммы — единый формат с валютой и разделителями тысяч; не «голое» число.",
    "feedbackPolicy (полированно-средняя): тосты на действия; пустые состояния с иллюстрацией и CTA; спиннеры на загрузке; без тяжёлой async-retry-обвязки (публичный продукт — путь должен быть гладким, не «техничным»).",
    "componentStyling: текст-кнопки с понятными публичными лейблами, крупная primary-CTA; тултипы по минимуму (UI самоочевиден).",
    "Кнопки формы — справа (конвенционально для публичных форм).",
    "Навигация: есть футер страницы (ссылки/легал/копирайт — лицо публичного продукта); крошек минимум (публичные экраны плоские)."
  ],
  "provenance": {
    "synthesizedFrom": [
      "Вручную (PoC-пример). В проде — синтез из кода/макетов сервиса + write-back правок с прогонов."
    ],
    "lastUpdated": "2026-06-09",
    "notes": "Фиктивный публичный продукт. Значения — противоположный Meridian конец пространства (light/spacious/centered/uniform/FieldDescription/Slider/page-constructor), чтобы слоение было наблюдаемо."
  }
}
