{
  "schemaVersion": "1",
  "name": "service-sprout",
  "tenant": "gravity-ui",
  "service": {
    "title": "Sprout",
    "domain": "CRM — контакты, сделки, воронка продаж",
    "audience": "Менеджеры по продажам; работа за десктопом в рабочее время",
    "description": "CRM для ведения контактов и сделок по воронке. Характер интерфейса — собранно и аккуратно, средней плотности: не игрушка и не тяжёлый энтерпрайз."
  },
  "theme": {
    "base": "light",
    "allowSwitch": true,
    "note": "Светлая база по умолчанию + опциональный переключатель light/dark (тёмную «не вылизываем»). Фирменный цвет — свежий зелёный #16A34A, лицо продукта. Готовой Themer/Figma-темы пока НЕТ — themeConfig опущен (омиссия = дефолтный акцент Гравити). TODO: сгенерировать тему от #16A34A через Themer/uikit-themer и подключить отдельно (.theme.css после uikit styles.css)."
  },
  "density": {
    "default": "normal",
    "note": "Средняя плотность (явно подтверждена владельцем): size m, стандартная шкала отступов. Характер — собранно/аккуратно, не игрушка и не энтерпрайз."
  },
  "contentLayout": {
    "width": "fluid-capped",
    "maxWidth": "1200px",
    "align": "center",
    "adaptive": {
      "policy": "desktop-only",
      "breakpoints": "Десктоп, рабочее время. Мобильную версию специально не поддерживаем, но на узком окне раскладка не должна разваливаться (graceful degrade, без отдельного мобильного дизайна)."
    },
    "note": "Главные экраны не на всю ширину: контент по центру, колонка ограничена ~1200px. Мобайл не приоритет."
  },
  "formPolicy": {
    "fieldWidth": "uniform",
    "formMaxWidth": "640px",
    "labelPlacement": "form-row-top",
    "descriptionDefault": "field-description",
    "requiredMarking": "per-field",
    "note": "Подписи сверху (FormRow direction=column), короткое пояснение под полем при необходимости (FieldDescription), поля единой ширины, обязательные — звёздочкой у каждого поля.",
    "footerActions": "right"
  },
  "navigation": {
    "homeScreen": true,
    "navPattern": "aside-header",
    "breadcrumbs": "detail-only",
    "note": "Разделы: Обзор / Контакты / Сделки / Настройки; первый экран после входа — Обзор (дашборд воронки: KPI-карточки + сводка по этапам). Крошки — только на карточках контакта/сделки."
  },
  "interactionPolicy": {
    "unsavedGuard": true,
    "note": "Уход со страницы редактирования с несохранёнными правками — Dialog-подтверждение; универсальная корректность подтверждения опасного — registry."
  },
  "feedbackPolicy": {
    "depth": "standard",
    "note": "Тосты на действия; скелетоны при загрузке списков; пустые состояния (PlaceholderContainer с CTA); валидация полей. Без «техничной» async-retry-обвязки — дружелюбно, но собранно."
  },
  "componentStyling": {
    "buttonContent": "text",
    "tooltips": "HelpMark/тултип — для второстепенной информации.",
    "note": "Иконки — на ключевых действиях."
  },
  "approvedComponents": {
    "policy": "open",
    "preferred": {
      "Каркас приложения с боковым меню": "AsideHeader (@gravity-ui/navigation)",
      "Список контактов (таблица с фильтрами и действиями в строке)": "@gravity-ui/table (withTableActions)",
      "Статусы / этапы — цветные ярлычки": "Label с theme",
      "Воронка сделок — канбан-доска по этапам": "@gravity-ui/dnd-list (доска колонок по этапам)"
    },
    "note": "Открытый набор компонентов Гравити; preferred фиксирует выбор на типовых развилках CRM-экранов."
  },
  "archetypes": [
    {
      "name": "Обзор (дашборд воронки)",
      "when": "Первый экран после входа — стартовая страница",
      "structure": "AsideHeader (меню слева: Обзор / Контакты / Сделки / Настройки) → дашборд воронки: ряд KPI-карточек (Card) + сводка по этапам. Без крошек (это раздел верхнего уровня).",
      "ref": "recipe-dashboard"
    },
    {
      "name": "Список контактов",
      "when": "Раздел «Контакты» — таблица контактов",
      "structure": "AsideHeader → шапка раздела → панель фильтров НАД таблицей (TextInput-поиск + Select по владельцу/этапу) → @gravity-ui/table с действиями в строке (withTableActions). Статусы/этапы — цветными Label. Без крошек на списке.",
      "ref": "recipe-dashboard"
    },
    {
      "name": "Карточка контакта",
      "when": "Детали одного контакта",
      "structure": "AsideHeader → Breadcrumbs (детальный экран) → заголовок → TabProvider: Детали (DefinitionList) / История / Связанные сделки. Даты — относительные («2 дня назад»), точная по наведению.",
      "ref": "library-routing"
    },
    {
      "name": "Воронка сделок",
      "when": "Раздел «Сделки» — канбан по этапам",
      "structure": "AsideHeader → доска (канбан): колонки = этапы воронки, карточки сделок в колонках. Статусы — цветными Label. Без крошек на доске.",
      "ref": "recipe-dashboard"
    },
    {
      "name": "Карточка сделки",
      "when": "Детали одной сделки",
      "structure": "AsideHeader → Breadcrumbs (детальный экран) → заголовок + статус (Label) → детали сделки. Даты относительные с точной по наведению.",
      "ref": "library-routing"
    },
    {
      "name": "Форма (редактирование контакта/сделки)",
      "when": "Создать или изменить контакт/сделку",
      "structure": "Полоса 640px, FormRow с подписью сверху, FieldDescription под полем, поля единой ширины, обязательные — звёздочкой. Гард несохранённых изменений: при уходе со страницы с несохранёнными правками — Dialog-подтверждение, чтобы не потерять данные.",
      "ref": "recipe-settings-form"
    }
  ],
  "glossary": [
    {
      "term": "Контакт",
      "meaning": "Человек в базе CRM",
      "preferredLabel": "Контакт"
    },
    {
      "term": "Сделка",
      "meaning": "Потенциальная продажа",
      "preferredLabel": "Сделка"
    },
    {
      "term": "Воронка",
      "meaning": "Pipeline — последовательность этапов продажи",
      "preferredLabel": "Воронка"
    },
    {
      "term": "Этап",
      "meaning": "Стадия сделки в воронке",
      "preferredLabel": "Этап"
    },
    {
      "term": "Компания",
      "meaning": "Организация, к которой относится контакт/сделка",
      "preferredLabel": "Компания"
    },
    {
      "term": "Владелец",
      "meaning": "Ответственный менеджер за контакт/сделку",
      "preferredLabel": "Владелец"
    }
  ],
  "conventions": [
    "Списки по умолчанию несут панель фильтров НАД таблицей (поиск + фильтр по владельцу/этапу) и действия в строке.",
    "Статусы и этапы — цветными ярлычками (Label с theme), не цветной Text.",
    "Даты — относительные («2 дня назад»), точное значение — по наведению (tooltip).",
    "Терминология строго русская и доменная: Контакт/Сделка/Воронка/Этап/Компания/Владелец. НЕ «лид», НЕ «оппортьюнити».",
    "Опасные действия (удалить) — через Dialog-подтверждение (универсальная корректность Гравити; вынесено как акцент)."
  ],
  "provenance": {
    "synthesizedFrom": [
      "Интервью (наивная цепочка владелец↔интервьюер), 2 раунда: свободное описание сервиса (раунд 1) + уточняющие ответы владельца (тема/бренд, ширина контента, форм-политика, словарь, навигация и структурные/поведенческие конвенции)."
    ],
    "lastUpdated": "2026-07-11",
    "notes": "Выведено из описания (раунд 1): density=normal (характер «собранно/аккуратно»); contentLayout=desktop по адаптивности; archetypes — типовые CRM-экраны; glossary — доменные термины; approvedComponents=open. Спрошено и подтверждено (раунд 2): тема/бренд (light + switch, бренд #16A34A → themeConfig TODO), точная ширина контента (~1200px, fluid-capped по центру), форм-политика (подписи сверху / FieldDescription / uniform / per-field), русский словарь, навигация. В conventions / archetypes[].structure вынесены структурно-поведенческие конвенции, для которых в схеме нет полей: главная «Обзор», политика крошек «только детали», фильтры над таблицей, гард несохранённых изменений, статусы-ярлыки, относительные даты (см. structural-conventions.md — design-note, ещё не промоутнут в схему). themeConfig опущен (готовой темы нет → дефолт до генерации); brandTokens опущены (тему генерируем через Themer, токены руками не подбираем); referenceScreens нет (кода не было). Омиссия = универсальный дефолт. 2026-07-11: структурные конвенции переложены из conventions в промоутнутые поля (navigation / interactionPolicy / feedbackPolicy / componentStyling / formPolicy.footerActions)."
  }
}
